courses_id,course_name,department_id
MATH_1005, Introduction to College Mathematics,MATH
MATH_1011, College Algebra,MATH
MATH_1012, Quantitative Reasoning and Mathematical Skills,MATH
MATH_1021, College Trigonometry,MATH
MATH_1071, Finite Mathematics for Social Science and Business,MATH
MATH_1081, Calculus for Social Science and Business,MATH
MATH_1110, Mathematics for Elementary Educators 1,MATH
MATH_1112, Mathematical Analysis in Business,MATH
MATH_1120, Mathematics for Elementary Educators 2,MATH
MATH_1130, Mathematics from the Visual Arts,MATH
MATH_1150, Precalculus Mathematics,MATH
MATH_1151, Precalculus Supplemental Lab,MATH
MATH_1160," Transition to Calculus (IBL): The Theory, Applications and Analysis of Functions",MATH
MATH_1212, Data and Models,MATH
MATH_1300, Calculus 1,MATH
MATH_1301, Calculus 1 Supplemental Lab,MATH
MATH_1310, Calculus for Life Sciences,MATH
MATH_1330, Calculus for Economics and the Social Sciences,MATH
MATH_2001, Introduction to Discrete Mathematics,MATH
MATH_2002, Number Systems: An Introduction to Higher Mathematics,MATH
MATH_2130, Introduction to Linear Algebra for Non-Mathematics Majors,MATH
MATH_2135, Introduction to Linear Algebra for Mathematics Majors,MATH
MATH_2300, Calculus 2,MATH
MATH_2380, Mathematics for the Environment,MATH
MATH_2400, Calculus 3,MATH
MATH_2510, Introduction to Statistics,MATH
MATH_3001, Analysis 1,MATH
MATH_3110, Introduction to Theory of Numbers,MATH
MATH_3120, Functions and Modeling,MATH
MATH_3130, Introduction to Linear Algebra,MATH
MATH_3135, Honors Introduction to Linear Algebra,MATH
MATH_3140, Abstract Algebra 1,MATH
MATH_3170, Combinatorics 1,MATH
MATH_3210, Euclidean and Non-Euclidean Geometry,MATH
MATH_3430, Ordinary Differential Equations,MATH
MATH_3450, Introduction to Complex Variables,MATH
MATH_3510, Introduction to Probability and Statistics,MATH
MATH_3850, Seminar in Guided Mathematics Instruction,MATH
MATH_4000, Foundations of Mathematics,MATH
MATH_4001, Analysis 2,MATH
MATH_4120, Introduction to Operations Research,MATH
MATH_4140, Abstract Algebra 2,MATH
MATH_4200, Introduction to Topology,MATH
MATH_4230, Differential Geometry of Curves and Surfaces,MATH
MATH_4240, Hilbert Spaces and the Mathematics of Quantum Mechanics,MATH
MATH_4330, Fourier Analysis,MATH
MATH_4440, Mathematics of Coding and Cryptography,MATH
MATH_4470, Partial Differential Equations,MATH
MATH_4510, Introduction to Probability Theory,MATH
MATH_4520, Introduction to Mathematical Statistics,MATH
MATH_4530, Theoretical Foundations of Data Science,MATH
MATH_4540, Introduction to Time Series,MATH
MATH_4650, Intermediate Numerical Analysis 1,MATH
MATH_4660, Intermediate Numerical Analysis 2,MATH
MATH_4730, Set Theory,MATH
MATH_4805, Mathematical Teacher Training: Inclusive Pedagogy,MATH
MATH_4810, Special Topics in Mathematics,MATH
MATH_4820, History of Mathematical Ideas,MATH
MATH_4890, Honors Independent Study,MATH
MATH_4900, Independent Study,MATH
MATH_5000, Foundations of Mathematics,MATH
MATH_5001, Analysis 2,MATH
MATH_5030, Intermediate Mathematical Physics 1,MATH
MATH_5040, Intermediate Mathematical Physics 2,MATH
MATH_5120, Introduction to Operations Research,MATH
MATH_5140, Abstract Algebra 2,MATH
MATH_5150, Linear Algebra,MATH
MATH_5200, Introduction to Topology,MATH
MATH_5230, Differential Geometry of Curves and Surfaces,MATH
MATH_5240, Hilbert Spaces and the Mathematics of Quantum Mechanics,MATH
MATH_5330, Fourier Analysis,MATH
MATH_5430, Ordinary Differential Equations,MATH
MATH_5440, Mathematics of Coding and Cryptography,MATH
MATH_5470, Partial Differential Equations,MATH
MATH_5510, Introduction to Probability Theory,MATH
MATH_5520, Introduction to Mathematical Statistics,MATH
MATH_5540, Introduction to Time Series,MATH
MATH_5600, Numerical Analysis 1,MATH
MATH_5610, Numerical Analysis 2,MATH
MATH_5730, Set Theory,MATH
MATH_5810, Special Topics in Mathematics,MATH
MATH_5820, History of Mathematical Ideas,MATH
MATH_5905, Mathematics Teacher Training,MATH
MATH_6000, Model Theory,MATH
MATH_6010, Computability Theory,MATH
MATH_6110, Introduction to Number Theory,MATH
MATH_6130, Algebra 1,MATH
MATH_6140, Algebra 2,MATH
MATH_6150, Commutative Algebra,MATH
MATH_6170, Algebraic Geometry,MATH
MATH_6180, Algebraic Number Theory,MATH
MATH_6190, Analytic Number Theory,MATH
MATH_6210, Introduction to Topology 1,MATH
MATH_6220, Introduction to Topology 2,MATH
MATH_6230, Introduction to Differential Geometry 1,MATH
MATH_6240, Introduction to Differential Geometry 2,MATH
MATH_6250, Theory of Rings,MATH
MATH_6260, Geometry of Quantum Fields and Strings,MATH
MATH_6270, Theory of Groups,MATH
MATH_6280, Advanced Algebraic Topology,MATH
MATH_6290, Homological Algebra,MATH
MATH_6310, Introduction to Real Analysis 1,MATH
MATH_6320, Introduction to Real Analysis 2,MATH
MATH_6350, Functions of a Complex Variable 1,MATH
MATH_6360, Functions of a Complex Variable 2,MATH
MATH_6534, Topics in Mathematical Probability,MATH
MATH_6550, Introduction to Stochastic Processes,MATH
MATH_6730, Set Theory,MATH
MATH_6740, Forcing,MATH
MATH_6900, Independent Study,MATH
MATH_6940, Master's Candidate for Degree,MATH
MATH_6950, Master's Thesis,MATH
MATH_8114, Topics in Number Theory,MATH
MATH_8174, Topics in Algebra I,MATH
MATH_8234, Topics in Differential Geometry,MATH
MATH_8250, Mathematical Theory of Relativity 1,MATH
MATH_8304, Topics in Analysis 1,MATH
MATH_8330, Functional Analysis 1,MATH
MATH_8340, Functional Analysis 2,MATH
MATH_8370, Harmonic Analysis 1,MATH
MATH_8714, Topics in Logic 1 and 2,MATH
MATH_8815, Ulam Seminar,MATH
MATH_8900, Independent Study,MATH
MATH_8990, Doctoral Dissertation,MATH
MBAX_6000, Socially Responsible Enterprise,MBAX
MBAX_6051, Strategy,MBAX
MBAX_6080, Decision Modeling and Applications,MBAX
MBAX_6100, Entrepreneurship,MBAX
MBAX_6101, Entrepreneurship,MBAX
MBAX_6105, Design Thinking for National Security,MBAX
MBAX_6110, Entrepreneurial Finance,MBAX
MBAX_6111, Entrepreneurial Finance,MBAX
MBAX_6130, Sustainable Venturing,MBAX
MBAX_6140, Social Entrepreneurship in Emerging Markets,MBAX
MBAX_6160, Entrepreneurship: High Growth Companies,MBAX
MBAX_6170, New Venture Creation,MBAX
MBAX_6171, New Venture Creation,MBAX
MBAX_6180, New Venture Launch,MBAX
MBAX_6190, Projects in Entrepreneurial Companies,MBAX
MBAX_6195, Special Topics in Entrepreneurship,MBAX
MBAX_6210, Applied Financial Management,MBAX
MBAX_6211, Applied Financial Management,MBAX
MBAX_6220, Investment Management and Analysis,MBAX
MBAX_6221, Investment Management & Analysis,MBAX
MBAX_6230, International Financial Management,MBAX
MBAX_6240," Financial Markets, Institutions and Regulations",MBAX
MBAX_6250, Derivative Securities,MBAX
MBAX_6260, Fixed Income Investing,MBAX
MBAX_6270, Applied Derivatives,MBAX
MBAX_6280, Entrepreneurship Valuation and Investment Seminar,MBAX
MBAX_6281, Entrepreneurship Valuation and Investment Seminar2,MBAX
MBAX_6282, Entrepreneurship Valuation and Investment Seminar 3,MBAX
MBAX_6300, Marketing Communication,MBAX
MBAX_6301, Marketing Communications,MBAX
MBAX_6310, Marketing Strategy,MBAX
MBAX_6311, Marketing Strategy,MBAX
MBAX_6330, Market Intelligence,MBAX
MBAX_6331, Market Intelligence,MBAX
MBAX_6340, Marketing Field Project,MBAX
MBAX_6350, Digital Marketing,MBAX
MBAX_6351, Digital Marketing,MBAX
MBAX_6360, New Product Development,MBAX
MBAX_6361, New Product Development,MBAX
MBAX_6365, Practical Product Management,MBAX
MBAX_6368, Consumer Packaged Goods Marketing Applied to the Natural & Organic Industry,MBAX
MBAX_6370, Customer Analytics,MBAX
MBAX_6372, Professional Selling and Sales Management,MBAX
MBAX_6380," Consumer Decision-Making: Behavioral Economics, Psychology, and Experimental Design",MBAX
MBAX_6381," Consumer Decision-Making: Behavioral Economics, Psychology, and Experimental Design",MBAX
MBAX_6410, Process Analytics,MBAX
MBAX_6420, IT and Business Strategy,MBAX
MBAX_6421, IT & Business Strategy,MBAX
MBAX_6440, Project Management,MBAX
MBAX_6441, Project Management,MBAX
MBAX_6450, International Operations Management,MBAX
MBAX_6451, International Business and Strategy,MBAX
MBAX_6460, Supply Chain Management,MBAX
MBAX_6500, Management of Organizational Change,MBAX
MBAX_6530, Negotiating and Conflict Management,MBAX
MBAX_6531, Negotiations,MBAX
MBAX_6540, Consulting Skills,MBAX
MBAX_6550, Management of Technology and Innovation,MBAX
MBAX_6560, Executive Leadership,MBAX
MBAX_6561, Executive Leadership,MBAX
MBAX_6565, Inclusive Leadership,MBAX
MBAX_6570, Topics in Sustainable Business,MBAX
MBAX_6595, Special Topics in Organizational Behavior,MBAX
MBAX_6600, Real Estate Principles,MBAX
MBAX_6610, Real Estate Finance and Investment Analysis,MBAX
MBAX_6620, Real Estate Project Competition,MBAX
MBAX_6630, Real Estate Economics,MBAX
MBAX_6640, Real Estate Law and Practice,MBAX
MBAX_6695, Special Topics in Real Estate,MBAX
MBAX_6700, Corporate Financial Reporting,MBAX
MBAX_6710, Financial Statement Analysis,MBAX
MBAX_6761," Managerial Accounting, Planning and Control",MBAX
MBAX_6801, Global Perspectives Seminar,MBAX
MBAX_6802, Pricing Strategy and Tactics,MBAX
MBAX_6806, Global Perspectives,MBAX
MBAX_6815, Sustainable Real Estate,MBAX
MBAX_6827, Integrated Reporting for Socially Responsible Strategies,MBAX
MBAX_6841, Decision Making for Managers,MBAX
MBAX_6843, Supply Chain and Operations Analytics,MBAX
MBAX_6846, Global Strategy,MBAX
MBAX_6847, Emerging Markets in Global Business,MBAX
MBAX_6885, Interpreting the Economic Environment,MBAX
MBAX_6930, Commercializing Sustainable Energy Technologies,MBAX
MBAX_6966, Independent Study-Real Estate,MBAX
MBAC_6001, Foundations of Teamwork,MBAC
MBAC_6002," Social, Moral and Economic Foundations for Business",MBAC
MBAC_6003, Foundations of Leadership,MBAC
MBAC_6010, Managerial Economics,MBAC
MBAC_6011, Managerial Economics 1,MBAC
MBAC_6012, Managerial Economics 2,MBAC
MBAC_6020, Financial Accounting,MBAC
MBAC_6030, Quantitative Methods,MBAC
MBAC_6031, Quantitative Methods 1,MBAC
MBAC_6032, Quantitative Methods 2,MBAC
MBAC_6050, Strategy,MBAC
MBAC_6051, Operations Management,MBAC
MBAC_6052, Capstone Projects,MBAC
MBAC_6060, Corporate Finance,MBAC
MBAC_6080, Decision Modeling and Applications,MBAC
MBAC_6081, Data and Decisions,MBAC
MBAC_6090, Marketing Management,MBAC
MBAC_6096, Managerial Communications,MBAC
MBAC_6098, Professional Development I,MBAC
MBAC_6099, Professional Development II,MBAC
MCEN_1024, Chemistry for Energy and Materials Science,MCEN
MCEN_1025, Computer-Aided Design and Fabrication,MCEN
MCEN_1208, Special Topics in Mechanical Engineering,MCEN
MCEN_2000, Mechanical Engineering as a Profession,MCEN
MCEN_2023, Statics and Structures,MCEN
MCEN_2024, Materials Science,MCEN
MCEN_2043, Dynamics,MCEN
MCEN_2063, Mechanics of Solids,MCEN
MCEN_3012, Thermodynamics,MCEN
MCEN_3017, Circuits and Electronics,MCEN
MCEN_3021, Fluid Mechanics,MCEN
MCEN_3022, Heat Transfer,MCEN
MCEN_3025, Component Design,MCEN
MCEN_3030, Computational Methods,MCEN
MCEN_3032, Thermodynamics 2,MCEN
MCEN_3047, Data Analysis and Experimental Methods,MCEN
MCEN_3208, Special Topics in Mechanical Engineering,MCEN
MCEN_3930, Mechanical Engineering Cooperative Education,MCEN
MCEN_4010, Microsystems Integration,MCEN
MCEN_4012," Renewable Fuels, Fuel Cells and Internal Combustion Engines",MCEN
MCEN_4026, Manufacturing Processes and Systems,MCEN
MCEN_4032, Sustainable Energy,MCEN
MCEN_4043, System Dynamics,MCEN
MCEN_4045, Mechanical Engineering Design Project 1,MCEN
MCEN_4057, Environmental Modeling,MCEN
MCEN_4064, Soft Machines,MCEN
MCEN_4085, Mechanical Engineering Senior Design Project 2,MCEN
MCEN_4086, Writing for Design Projects,MCEN
MCEN_4113, Mechanics of Cancer,MCEN
MCEN_4115, Mechatronics and Robotics I,MCEN
MCEN_4117, Anatomy and Physiology for Engineers,MCEN
MCEN_4123, Vibration Analysis,MCEN
MCEN_4124, Mechanical Behavior of Materials,MCEN
MCEN_4125, Optimal Design,MCEN
MCEN_4127, Biomedical Ultrasound,MCEN
MCEN_4131, Air Pollution Control Engineering,MCEN
MCEN_4133, Intro to Tissue Biomechanics,MCEN
MCEN_4135, Wind Energy and Wind Turbine Design,MCEN
MCEN_4137, Anatomy and Physiology 2,MCEN
MCEN_4138, Feedback Control,MCEN
MCEN_4141, Indoor Air Pollution,MCEN
MCEN_4151, Flow Visualization,MCEN
MCEN_4152, Introduction to Combustion,MCEN
MCEN_4154, Biocolloids and Biomembranes,MCEN
MCEN_4155, Automated Mechanical Design Synthesis,MCEN
MCEN_4157, Modeling of Human Movement,MCEN
MCEN_4162, Energy Conversion,MCEN
MCEN_4171, Biofluids on the Micro Scale,MCEN
MCEN_4173, Finite Element Analysis,MCEN
MCEN_4174, Failure of Engineering Materials,MCEN
MCEN_4183, Mechanics of Composite Materials,MCEN
MCEN_4194, Electrochemical Energy Conversion and Storage,MCEN
MCEN_4195, Bioinspired Robotics,MCEN
MCEN_4228, Special Topics in Mechanical Engineering,MCEN
MCEN_4238, Design for Community,MCEN
MCEN_4279, Aesthetics in Design,MCEN
MCEN_4291, Project Based Learning in Rural Schools,MCEN
MCEN_4292, Materials and Devices in Medicine,MCEN
MCEN_4293, Mechanics of Soft Matter,MCEN
MCEN_4298, Introduction to Polymers,MCEN
MCEN_4299, Household Energy Systems,MCEN
MCEN_4700, Quantum Forge I,MCEN
MCEN_4710, Quantum Forge II,MCEN
MCEN_4848, Independent Study,MCEN
MCEN_5010, Microsystems Integration,MCEN
MCEN_5012," Renewable Fuels, Fuel Cells and Internal Combustion Engines",MCEN
MCEN_5014, Energy Materials Characterization,MCEN
MCEN_5020, Methods of Engineering Analysis 1,MCEN
MCEN_5021, Introduction to Fluid Dynamics,MCEN
MCEN_5022, Classical Thermodynamics,MCEN
MCEN_5023, Solid Mechanics 1,MCEN
MCEN_5024, Materials Chemistry and Structures,MCEN
MCEN_5027, Graduate Seminar,MCEN
MCEN_5032, Sustainable Energy,MCEN
MCEN_5034, Thermodynamics of Materials,MCEN
MCEN_5040, Methods of Engineering Analysis 2,MCEN
MCEN_5041, Advanced Fluid Mechanics 1,MCEN
MCEN_5042, Heat Transfer,MCEN
MCEN_5044, Mechanical Behavior of Materials,MCEN
MCEN_5045, Design for Manufacturability,MCEN
MCEN_5055, Advanced Product Design,MCEN
MCEN_5057, Environmental Modeling,MCEN
MCEN_5064, Soft Machines,MCEN
MCEN_5065, Graduate Design I,MCEN
MCEN_5075, Graduate Design II,MCEN
MCEN_5113, Mechanics of Cancer,MCEN
MCEN_5115, Mechatronics and Robotics I,MCEN
MCEN_5117, Anatomy and Physiology for Engineers,MCEN
MCEN_5121, Compressible Flow,MCEN
MCEN_5122, Statistical Thermodynamics,MCEN
MCEN_5125, Optimal Design,MCEN
MCEN_5127, Biomedical Ultrasound,MCEN
MCEN_5131, Air Pollution Control Engineering,MCEN
MCEN_5133, Intro to Tissue Biomechanics,MCEN
MCEN_5135, Wind Energy and Wind Turbine Design,MCEN
MCEN_5137, Anatomy and Physiology 2,MCEN
MCEN_5138, Feedback Control,MCEN
MCEN_5141, Indoor Air Pollution,MCEN
MCEN_5147, Mechanobiology,MCEN
MCEN_5151, Flow Visualization,MCEN
MCEN_5152, Introduction to Combustion,MCEN
MCEN_5153, Introduction to Fracture Mechanics,MCEN
MCEN_5154, Biocolloids and Biomembranes,MCEN
MCEN_5155, Automated Mechanical Design Synthesis,MCEN
MCEN_5157, Modeling of Human Movement,MCEN
MCEN_5161, Aerosols,MCEN
MCEN_5171, Biofluids on the Micro Scale,MCEN
MCEN_5173, Finite Element Analysis,MCEN
MCEN_5174, Failure of Engineering Materials,MCEN
MCEN_5183, Mechanics of Composite Materials,MCEN
MCEN_5194, Electrochemical Energy Conversion and Storage,MCEN
MCEN_5195, Bioinspired Robotics,MCEN
MCEN_5208, Special Topics,MCEN
MCEN_5228, Special Topics in Mechanical Engineering,MCEN
MCEN_5255, Design for Mfg,MCEN
MCEN_5258, Sp Tpcs-Combustion Seminar,MCEN
MCEN_5279, Aesthetics in Design,MCEN
MCEN_5291, Project Based Learning in Rural Schools,MCEN
MCEN_5292, Materials and Devices in Medicine,MCEN
MCEN_5293, Mechanics of Soft Matter,MCEN
MCEN_5298, Introduction to Polymers,MCEN
MCEN_5299, Household Energy Systems,MCEN
MCEN_5448, Linear Systems,MCEN
MCEN_5488, Geometric Control Theory,MCEN
MCEN_5498, Stochastic Control Theory,MCEN
MCEN_5636, Micro-Electro-Mechanical Systems 1,MCEN
MCEN_5832, Special Topics,MCEN
MCEN_5848, Independent Study,MCEN
MCEN_5858, Independent Study,MCEN
MCEN_5868, Independent Study,MCEN
MCEN_5878, Independent Study,MCEN
MCEN_5888, Independent Study,MCEN
MCEN_5930, Professional Internship,MCEN
MCEN_6001, Reacting Flows,MCEN
MCEN_6184, Structure and Properties of Polymers,MCEN
MCEN_6228, Special Topics in Mechanical Engineering,MCEN
MCEN_6848, Independent Study,MCEN
MCEN_6858, Independent Study,MCEN
MCEN_6868, Independent Study,MCEN
MCEN_6878, Independent Study,MCEN
MCEN_6888, Independent Study,MCEN
MCEN_6949, Master's Candidate for Degree,MCEN
MCEN_6959, Master's Thesis,MCEN
MCEN_7221, Turbulence,MCEN
MCEN_7228, Special Topics,MCEN
MCEN_8999, Doctoral Dissertation,MCEN
MDRP_7871, Special Topics,MDRP
MDST_1001, Foundations of Media Studies,MDST
MDST_1002, Introduction to Social Media,MDST
MDST_1003, Critical Media Literacies,MDST
MDST_1009," Truth, Beauty, and Conspiracy",MDST
MDST_2001, Introduction to Global Media,MDST
MDST_2002, Media and Communication History,MDST
MDST_2010, Media and Social Movements,MDST
MDST_2011, Disruptive Entrepreneurship in the Internet's New Economies,MDST
MDST_2012, Hacker Culture,MDST
MDST_2031, Documentary and Social Change,MDST
MDST_2032, Visual Literacies & Design,MDST
MDST_2046, Future Histories of Technology,MDST
MDST_3001, Media Research,MDST
MDST_3002, Digital Culture and Politics,MDST
MDST_3021, Comic Books: Culture and Industry,MDST
MDST_3022, Social Media Cultures,MDST
MDST_3201," Media, Culture and Globalization",MDST
MDST_3321, Media Industries and Economics,MDST
MDST_3331, Sports-Media Complex,MDST
MDST_3341, Designing Alternative Media Platforms,MDST
MDST_3401," Media, Food and Culture",MDST
MDST_3711, Media and Popular Culture,MDST
MDST_3791, Media and the Public,MDST
MDST_4003, Digital Media Production and Design,MDST
MDST_4111," Crime, Media and Contemporary Culture",MDST
MDST_4121, Deconstructing Disney: Mediated American Mythology,MDST
MDST_4211, Asian Media and Culture,MDST
MDST_4220, Viral Video & Media,MDST
MDST_4221, Media Technology and Cultural Change,MDST
MDST_4231, Youth Media: Culture and Politics,MDST
MDST_4241, Visual Culture and Human Rights,MDST
MDST_4311, Mass Communication Criticism,MDST
MDST_4331," Gender, Race, Class, and Sexuality in Popular Culture",MDST
MDST_4341, International Media and Global Crises,MDST
MDST_4361, TV and the Family in American Culture and Society,MDST
MDST_4371, Media and Religion,MDST
MDST_4372," Islam, Pop Culture and Media",MDST
MDST_4401, Fan and Audience Studies,MDST
MDST_4402, Transmedia Worldbuilding,MDST
MDST_4601," Media Law, Policy and Ethics",MDST
MDST_4841, Undergraduate Independent Study,MDST
MDST_4871, Special Topics,MDST
MDST_4931, Internship,MDST
MDST_5001, Connected Media Practices,MDST
MDST_5002, Media Activism and Public Engagement,MDST
MDST_5003, Digital Media Production and Design,MDST
MDST_5071, Screenwriting,MDST
MDST_5121, Deconstructing Disney: Mediated American Mythology,MDST
MDST_5211, Asian Media and Culture,MDST
MDST_5220, Viral Video & Media,MDST
MDST_5311, Mass Communication Criticism,MDST
MDST_5331," Gender, Race, Class, and Sexuality in Popular Culture",MDST
MDST_5341, Designing Alternative Media Platforms,MDST
MDST_5401, Fan and Audience Studies,MDST
MDST_5402, Transmedia Worldbuilding,MDST
MDST_5405, Queer & Trans Identities in Popular Culture,MDST
MDST_5841, Graduate Independent Study,MDST
MDST_5851, Graduate Professional Project,MDST
MDST_5871, Special Topics,MDST
MDST_5931, Internship,MDST
MDST_6031, Documentary and Social Change,MDST
MDST_6051, Media Theories,MDST
MDST_6061, Media Research,MDST
MDST_6071, Critical Theories of Media and Culture,MDST
MDST_6201, Global Media and Culture,MDST
MDST_6211, Communication and International Development,MDST
MDST_6241, Visual Epistemologies: Theory and Practice,MDST
MDST_6250," Algorithms, Culture, and Power",MDST
MDST_6301," Communication, Media, and Concepts of the Public",MDST
MDST_6311," Power, Politics and Mediated Culture",MDST
MDST_6341," Children, Youth and the Media",MDST
MDST_6350, Media & Cultural Policy,MDST
MDST_6351," Media, Culture & Food Politics",MDST
MDST_6551, Media and Communication Policy,MDST
MDST_6552, Media and Public Scholarship,MDST
MDST_6671," Media, Myth, and Ritual",MDST
MDST_6711, Media and Popular Culture,MDST
MDST_6721, Feminist Media Studies,MDST
MDST_6771, History of Media and Communication,MDST
MDST_6781, Economic and Political Aspects of Media,MDST
MDST_6871, Special Topics,MDST
MDST_6940, Master's Candidate for Degree,MDST
MDST_6951, Master's Thesis,MDST
MDST_7001, PhD Colloquium Series,MDST
MDST_7011, Proseminar in Media Communication Theory 1,MDST
MDST_7021, Proseminar in Media and Communication Theory 2,MDST
MDST_7051, Qualitative Research Methods in Media,MDST
MDST_7061, Quantitative Research Methods in Media,MDST
MDST_7841, Independent Study,MDST
MDST_7871, Special Topics,MDST
MDST_8991, Doctoral Dissertation,MDST
MEMS_2020, Introduction to Medieval and Renaissance Studies,MEMS
MEMS_4020, Medieval and Early Modern Studies: Texts and Contexts,MEMS
MEMS_4030, Medieval and Early Modern Studies: Special Topics,MEMS
MEMS_5020, Medieval and Early Modern Studies: Texts and Contexts,MEMS
MEMS_5030, Medieval and Early Modern Studies: Special Topics,MEMS
MILR_1011, Adventures in Leadership 1,MILR
MILR_1021, Adventures in Leadership 2,MILR
MILR_2031, Methods of Leadership and Management 1,MILR
MILR_2041, Methods of Leadership and Management 2,MILR
MILR_3052, Military Operations and Training 1,MILR
MILR_3062, Military Operations and Training 2,MILR
MILR_3090, Military Theory and Tactical Leadership,MILR
MILR_4072, Leadership 1: Adaptive Leadership,MILR
MILR_4082, Leadership 2: Leadrship in a Complex World,MILR
MILR_4840, Independent Study,MILR
MCDB_1020," Introduction to Molecular, Cellular and Developmental Biology Major",MCDB
MCDB_1030, Introduction to Molecular Biology,MCDB
MCDB_1041, Fundamentals of Human Genetics,MCDB
MCDB_1043, Exploring Genetics Laboratory,MCDB
MCDB_1111," Core Concepts in Biology I: Evolutionary, Molecular and Cell Biology",MCDB
MCDB_1150, Introduction to Cellular and Molecular Biology,MCDB
MCDB_1152, Problem Solving Co-Seminar for Introduction to Molecular and Cellular Biology,MCDB
MCDB_1161, From Dirt to DNA: Phage Genomics Laboratory I,MCDB
MCDB_1171, Drug Discovery Through Hands-on Screens I,MCDB
MCDB_1181, Biological Probiotic/Drug Discovery Through Hands-on Screens,MCDB
MCDB_1234, Skills Center: Modular Laboratory of Modern Molecular Biology Skills,MCDB
MCDB_2150, Principles of Genetics,MCDB
MCDB_2152, Problem Solving Co-Seminars for Genetics,MCDB
MCDB_2161," From DNA to Genes, Phage Genomics Laboratory II",MCDB
MCDB_2171, Drug Discovery Through Hands-On Screens 2,MCDB
MCDB_2200, Introduction to Biophysical Methods: From Brains to Bonds,MCDB
MCDB_2222," Core Concepts in Biology II: Genes, Genetics and Phenotypes",MCDB
MCDB_2350," Understanding Cancer: Introduction to the disease¿s biology, medicine, and societal implications",MCDB
MCDB_2840, Lower-Division Independent Study,MCDB
MCDB_3000, Synthetic Biology: Engineering Biomolecular Systems in the Laboratory,MCDB
MCDB_3010, Undergraduate Teaching in Course-Based Undergraduate Research Experiences,MCDB
MCDB_3105, Antibiotics: Functions and Failures,MCDB
MCDB_3135, Molecular Biology,MCDB
MCDB_3140, Cell Biology Laboratory,MCDB
MCDB_3145, Cell Biology,MCDB
MCDB_3150, Biology of the Cancer Cell,MCDB
MCDB_3160, Infectious Disease,MCDB
MCDB_3171, Advanced Discovery Based Lab - Antibiotics,MCDB
MCDB_3300, Personalized Medicine - Recent Advances in Diagnostics and Therapeutics,MCDB
MCDB_3330, Evolution and Creationism,MCDB
MCDB_3332, Scientific Ethics,MCDB
MCDB_3333, Biomedical Innovations and Discoveries,MCDB
MCDB_3350," Fertility, Sterility, and Early Mammalian Development",MCDB
MCDB_3450, Biological Data Science,MCDB
MCDB_3501, Structural Methods for Biological Macromolecules,MCDB
MCDB_3650, The Brain - From Molecules to Behavior,MCDB
MCDB_3651, The Brain: Dysfunction to Disease,MCDB
MCDB_3700, Poisons in Cell Biology and Society,MCDB
MCDB_3990, Introduction to Systems Biololgy for Biologists,MCDB
MCDB_4100, Special Topics,MCDB
MCDB_4101, Manipulating Genomes-Discovering Gene Functions,MCDB
MCDB_4105," Function of Cellular and Nuclear, Assemblies, and Machines",MCDB
MCDB_4111, Experimental Design and Research in Cell and Molecular Biology,MCDB
MCDB_4150, Biology of Aging and Longevity,MCDB
MCDB_4185, Geomicrobiology,MCDB
MCDB_4201, From Bench to Bedside: The Role of Science in Medicine,MCDB
MCDB_4202, The Python Project,MCDB
MCDB_4234, Research Methods,MCDB
MCDB_4300, Immunology,MCDB
MCDB_4310, Microbial Genetics and Physiology,MCDB
MCDB_4312, Quantitative Optical Imaging,MCDB
MCDB_4350, Microbial Diversity and the Biosphere,MCDB
MCDB_4361, Evolution and Development,MCDB
MCDB_4410, Human Molecular Genetics,MCDB
MCDB_4420, Genetics of Brain and Behavior,MCDB
MCDB_4422," Molecular Biology of Free Radicals: Role(s) in Oxidative Stress, Signaling, Disease, Aging",MCDB
MCDB_4425," Topics in Membrane Biology: Cell Biology, Physiology and Disease",MCDB
MCDB_4426, Cell Signaling and Developmental Regulation,MCDB
MCDB_4427, Biology of the Visual System,MCDB
MCDB_4428, Regulation of Lifespan,MCDB
MCDB_4441, Animal Developmental Diversity,MCDB
MCDB_4444, Cellular Basis of Disease,MCDB
MCDB_4471, Mechanisms of Gene Regulation in Eukaryotes,MCDB
MCDB_4520, Bioinformatics and Genomics,MCDB
MCDB_4521, Bioinformatics and Genomics Laboratory,MCDB
MCDB_4550," Cells, Molecules and Tissues: A Biophysical Approach",MCDB
MCDB_4560, Introduction to Biophysics,MCDB
